{"$schema":"https://json-schema.org/draft/2020-12/schema","title":"Genesis Self Host Frontier","type":"object","required":["kind","version","release_status","components"],"properties":{"kind":{"const":"GENESIS_SELF_HOST_FRONTIER"},"version":{"const":"0.1.0"},"release_status":{"enum":["PARTIAL_SELF_HOST","FULL_SELF_HOST"]},"components":{"type":"object","additionalProperties":{"type":"object","required":["status","required_for_boot"],"properties":{"status":{"enum":["HOST_ORACLE","GENESIS_CONTROLLED","GENESIS_NATIVE","DEFERRED"]},"required_for_boot":{"type":"boolean"}}}}}}
