{"kind":"GENESIS_SELF_HOST_FRONTIER","version":"0.1.0","release_status":"PARTIAL_SELF_HOST","components":{"bootstrap_controller":{"status":"GENESIS_NATIVE","required_for_boot":true,"authority":"Genesis source + GIO bytecode"},"bootstrap_stage_sequencing":{"status":"GENESIS_CONTROLLED","required_for_boot":true,"authority":"Genesis runtime transaction"},"source_cas_transport":{"status":"GENESIS_CONTROLLED","required_for_boot":true,"authority":"Section 17 typed I/O"},"compiler_port_request":{"status":"GENESIS_CONTROLLED","required_for_boot":true,"authority":"BRANE compiler port ABI"},"parser":{"status":"HOST_ORACLE","required_for_boot":true,"authority":"Python reference"},"verifier":{"status":"HOST_ORACLE","required_for_boot":true,"authority":"Python reference"},"bytecode_encoder":{"status":"HOST_ORACLE","required_for_boot":true,"authority":"Python reference"},"semantic_linker":{"status":"HOST_ORACLE","required_for_boot":true,"authority":"Sections 09-18 reference stack"},"optimizer_codegen":{"status":"HOST_ORACLE","required_for_boot":true,"authority":"Sections 11-18 reference stack"},"compiler_port_adapter":{"status":"HOST_ORACLE","required_for_boot":true,"authority":"bootstrap bridge"},"runtime":{"status":"HOST_ORACLE","required_for_boot":true,"authority":"Python reference"},"blackglass_v3_migration":{"status":"DEFERRED","required_for_boot":false,"authority":"post Section-20"}}}
